{
  "schema_version": "uisemtest-recording-workflow-v1",
  "workflow_id": "ghost-modular-l2-author-03",
  "profile_ref": "fixtures/profiles/ghost_modular_local.json",
  "actors": [
    {
      "actor_id": "actor_b",
      "bootstrap": [
        {
          "bootstrap_step_id": "bootstrap.actor_b.entry",
          "action": {
            "kind": "navigate",
            "url": "http://127.0.0.1:18093/ghost/#/posts"
          },
          "waits": [
            {
              "kind": "load_state",
              "state": "domcontentloaded",
              "timeout_ms": 30000
            },
            {
              "kind": "dom_quiet",
              "quiet_ms": 300,
              "timeout_ms": 30000
            }
          ]
        }
      ],
      "ready_waits": [
        {
          "kind": "locator",
          "locator": {
            "kind": "css",
            "value": "[data-test-nav-menu=\"main\"]"
          },
          "state": "visible",
          "timeout_ms": 30000
        },
        {
          "kind": "locator",
          "locator": {
            "kind": "css",
            "value": "[data-test-new-post-button]"
          },
          "state": "visible",
          "timeout_ms": 30000
        }
      ]
    }
  ],
  "steps": [
    {
      "scenario_step_id": "story.s000",
      "workflow_step_id": "story.s000.click-new-post",
      "global_step_index": 0,
      "actor_id": "actor_b",
      "action": {
        "kind": "click",
        "locator": {
          "kind": "css",
          "value": "[data-test-new-post-button]"
        }
      },
      "waits": [
        {
          "kind": "url",
          "pattern": "#/editor/post",
          "timeout_ms": 30000
        },
        {
          "kind": "locator",
          "locator": {
            "kind": "css",
            "value": "[data-test-editor-title-input]"
          },
          "state": "visible",
          "timeout_ms": 30000
        }
      ]
    },
    {
      "scenario_step_id": "story.s001",
      "workflow_step_id": "story.s001.fill-editor-title",
      "global_step_index": 1,
      "actor_id": "actor_b",
      "action": {
        "kind": "fill",
        "locator": {
          "kind": "css",
          "value": "[data-test-editor-title-input]"
        },
        "value": "Author Published Post"
      },
      "waits": [
        {
          "kind": "dom_quiet",
          "quiet_ms": 250,
          "timeout_ms": 30000
        }
      ]
    },
    {
      "scenario_step_id": "story.s002",
      "workflow_step_id": "story.s002.press-enter",
      "global_step_index": 2,
      "actor_id": "actor_b",
      "action": {
        "kind": "press",
        "locator": {
          "kind": "css",
          "value": "[data-test-editor-title-input]"
        },
        "key": "Enter"
      },
      "waits": [
        {
          "kind": "locator",
          "locator": {
            "kind": "css",
            "value": "[data-test-editor-post-status]",
            "has_text": "Draft - Saved"
          },
          "state": "visible",
          "timeout_ms": 30000
        },
        {
          "kind": "network_quiet",
          "quiet_ms": 400,
          "timeout_ms": 30000
        }
      ]
    },
    {
      "scenario_step_id": "story.s003",
      "workflow_step_id": "story.s003.click-editor-header-publish",
      "global_step_index": 3,
      "actor_id": "actor_b",
      "action": {
        "kind": "click",
        "locator": {
          "kind": "css",
          "value": ".gh-editor-header [data-test-button=\"publish-flow\"]"
        }
      },
      "waits": [
        {
          "kind": "locator",
          "locator": {
            "kind": "css",
            "value": "[data-test-modal=\"publish-flow\"]"
          },
          "state": "visible",
          "timeout_ms": 30000
        },
        {
          "kind": "locator",
          "locator": {
            "kind": "css",
            "value": "[data-test-button=\"continue\"]"
          },
          "state": "visible",
          "timeout_ms": 30000
        }
      ]
    },
    {
      "scenario_step_id": "story.s004",
      "workflow_step_id": "story.s004.click-continue",
      "global_step_index": 4,
      "actor_id": "actor_b",
      "action": {
        "kind": "click",
        "locator": {
          "kind": "css",
          "value": "[data-test-button=\"continue\"]"
        }
      },
      "waits": [
        {
          "kind": "locator",
          "locator": {
            "kind": "css",
            "value": "[data-test-button=\"confirm-publish\"]"
          },
          "state": "visible",
          "timeout_ms": 30000
        }
      ]
    },
    {
      "scenario_step_id": "story.s005",
      "workflow_step_id": "story.s005.press-enter",
      "global_step_index": 5,
      "actor_id": "actor_b",
      "action": {
        "kind": "press",
        "locator": {
          "kind": "css",
          "value": "[data-test-button=\"confirm-publish\"]"
        },
        "key": "Enter"
      },
      "waits": [
        {
          "kind": "locator",
          "locator": {
            "kind": "css",
            "value": "[data-test-publish-flow=\"complete\"]"
          },
          "state": "visible",
          "timeout_ms": 30000
        },
        {
          "kind": "network_quiet",
          "quiet_ms": 400,
          "timeout_ms": 30000
        }
      ]
    },
    {
      "scenario_step_id": "story.s006",
      "workflow_step_id": "story.s006.click-close-publish-flow",
      "global_step_index": 6,
      "actor_id": "actor_b",
      "action": {
        "kind": "click",
        "locator": {
          "kind": "css",
          "value": "[data-test-button=\"close-publish-flow\"]"
        }
      },
      "waits": [
        {
          "kind": "locator",
          "locator": {
            "kind": "css",
            "value": "[data-test-modal=\"publish-flow\"]"
          },
          "state": "detached",
          "timeout_ms": 30000
        },
        {
          "kind": "network_quiet",
          "quiet_ms": 400,
          "timeout_ms": 30000
        }
      ]
    }
  ]
}
