{
  "schema_version": "uisemtest-recording-workflow-v1",
  "workflow_id": "ghost-modular-l1-setting-03",
  "profile_ref": "fixtures/profiles/ghost_modular_local.json",
  "actors": [
    {
      "actor_id": "actor_a",
      "bootstrap": [
        {
          "bootstrap_step_id": "bootstrap.actor_a.entry",
          "action": {
            "kind": "navigate",
            "url": "http://127.0.0.1:18093/ghost/#/dashboard"
          },
          "waits": [
            {
              "kind": "load_state",
              "state": "domcontentloaded",
              "timeout_ms": 30000
            },
            {
              "kind": "dom_quiet",
              "quiet_ms": 300,
              "timeout_ms": 30000
            }
          ]
        }
      ],
      "ready_waits": [
        {
          "kind": "locator",
          "locator": {
            "kind": "css",
            "value": "[data-test-nav-menu=\"main\"]"
          },
          "state": "visible",
          "timeout_ms": 30000
        },
        {
          "kind": "locator",
          "locator": {
            "kind": "css",
            "value": "[data-test-nav=\"dashboard\"]"
          },
          "state": "visible",
          "timeout_ms": 30000
        }
      ]
    }
  ],
  "steps": [
    {
      "scenario_step_id": "story.s000",
      "workflow_step_id": "story.s000.click-settings",
      "global_step_index": 0,
      "actor_id": "actor_a",
      "action": {
        "kind": "click",
        "locator": {
          "kind": "css",
          "value": "[data-test-nav=\"settings\"]"
        }
      },
      "waits": [
        {
          "kind": "locator",
          "locator": {
            "kind": "css",
            "value": "[data-testid=\"title-and-description\"]"
          },
          "state": "visible",
          "timeout_ms": 30000
        },
        {
          "kind": "network_quiet",
          "quiet_ms": 400,
          "timeout_ms": 30000
        }
      ]
    }
  ]
}
