{
  "schema_version": "uisemtest-recording-workflow-v1",
  "workflow_id": "l1-dashboard-05",
  "profile_ref": "fixtures/profiles/paperless_modular_local.json",
  "actors": [
    {
      "actor_id": "actor_a",
      "bootstrap": [
        {
          "bootstrap_step_id": "bootstrap.actor_a.entry",
          "action": {
            "kind": "navigate",
            "url": "http://127.0.0.1:18091/dashboard"
          },
          "waits": [
            {
              "kind": "load_state",
              "state": "domcontentloaded",
              "timeout_ms": 30000
            },
            {
              "kind": "dom_quiet",
              "quiet_ms": 400,
              "timeout_ms": 30000
            }
          ]
        }
      ],
      "ready_waits": [
        {
          "kind": "locator",
          "locator": {
            "kind": "css",
            "value": "pngx-app-frame button#userDropdown"
          },
          "state": "visible",
          "timeout_ms": 30000
        }
      ]
    }
  ],
  "steps": [
    {
      "scenario_step_id": "story.s000",
      "workflow_step_id": "story.s000.navigate",
      "global_step_index": 0,
      "actor_id": "actor_a",
      "action": {
        "kind": "navigate",
        "url": "http://127.0.0.1:18091/dashboard"
      },
      "waits": [
        {
          "kind": "load_state",
          "state": "domcontentloaded",
          "timeout_ms": 30000
        },
        {
          "kind": "locator",
          "locator": {
            "kind": "css",
            "value": "pngx-statistics-widget"
          },
          "state": "visible",
          "timeout_ms": 30000
        },
        {
          "kind": "dom_quiet",
          "quiet_ms": 400,
          "timeout_ms": 30000
        }
      ]
    },
    {
      "scenario_step_id": "story.s001",
      "workflow_step_id": "story.s001.click",
      "global_step_index": 1,
      "actor_id": "actor_a",
      "action": {
        "kind": "click",
        "locator": {
          "kind": "css",
          "value": ".sidebar-slim-toggler"
        }
      },
      "waits": [
        {
          "kind": "dom_quiet",
          "quiet_ms": 400,
          "timeout_ms": 30000
        }
      ]
    },
    {
      "scenario_step_id": "story.s002",
      "workflow_step_id": "story.s002.click",
      "global_step_index": 2,
      "actor_id": "actor_a",
      "action": {
        "kind": "click",
        "locator": {
          "kind": "css",
          "value": ".sidebar-slim-toggler"
        }
      },
      "waits": [
        {
          "kind": "dom_quiet",
          "quiet_ms": 400,
          "timeout_ms": 30000
        }
      ]
    }
  ]
}
