{
  "schema_version": "uisemtest-recording-workflow-v1",
  "workflow_id": "l1-docdetail-03",
  "profile_ref": "fixtures/profiles/paperless_modular_local.json",
  "actors": [
    {
      "actor_id": "actor_a",
      "bootstrap": [
        {
          "bootstrap_step_id": "bootstrap.actor_a.entry",
          "action": {
            "kind": "navigate",
            "url": "http://127.0.0.1:18091/dashboard"
          },
          "waits": [
            {
              "kind": "load_state",
              "state": "domcontentloaded",
              "timeout_ms": 30000
            },
            {
              "kind": "dom_quiet",
              "quiet_ms": 400,
              "timeout_ms": 30000
            }
          ]
        }
      ],
      "ready_waits": [
        {
          "kind": "locator",
          "locator": {
            "kind": "css",
            "value": "pngx-app-frame button#userDropdown"
          },
          "state": "visible",
          "timeout_ms": 30000
        }
      ]
    }
  ],
  "steps": [
    {
      "scenario_step_id": "story.s000",
      "workflow_step_id": "story.s000.navigate",
      "global_step_index": 0,
      "actor_id": "actor_a",
      "action": {
        "kind": "navigate",
        "url": "http://127.0.0.1:18091/documents/1/details"
      },
      "waits": [
        {
          "kind": "load_state",
          "state": "domcontentloaded",
          "timeout_ms": 30000
        },
        {
          "kind": "locator",
          "locator": {
            "kind": "css",
            "value": "pngx-document-detail"
          },
          "state": "visible",
          "timeout_ms": 30000
        },
        {
          "kind": "dom_quiet",
          "quiet_ms": 400,
          "timeout_ms": 30000
        }
      ]
    },
    {
      "scenario_step_id": "story.s001",
      "workflow_step_id": "story.s001.navigate",
      "global_step_index": 1,
      "actor_id": "actor_a",
      "action": {
        "kind": "navigate",
        "url": "http://127.0.0.1:18091/documents/1/content"
      },
      "waits": [
        {
          "kind": "load_state",
          "state": "domcontentloaded",
          "timeout_ms": 30000
        },
        {
          "kind": "locator",
          "locator": {
            "kind": "css",
            "value": "pngx-document-detail"
          },
          "state": "visible",
          "timeout_ms": 30000
        },
        {
          "kind": "dom_quiet",
          "quiet_ms": 400,
          "timeout_ms": 30000
        }
      ]
    },
    {
      "scenario_step_id": "story.s002",
      "workflow_step_id": "story.s002.navigate",
      "global_step_index": 2,
      "actor_id": "actor_a",
      "action": {
        "kind": "navigate",
        "url": "http://127.0.0.1:18091/documents/1/metadata"
      },
      "waits": [
        {
          "kind": "load_state",
          "state": "domcontentloaded",
          "timeout_ms": 30000
        },
        {
          "kind": "locator",
          "locator": {
            "kind": "css",
            "value": "pngx-document-detail"
          },
          "state": "visible",
          "timeout_ms": 30000
        },
        {
          "kind": "dom_quiet",
          "quiet_ms": 400,
          "timeout_ms": 30000
        }
      ]
    },
    {
      "scenario_step_id": "story.s003",
      "workflow_step_id": "story.s003.navigate",
      "global_step_index": 3,
      "actor_id": "actor_a",
      "action": {
        "kind": "navigate",
        "url": "http://127.0.0.1:18091/documents/1/notes"
      },
      "waits": [
        {
          "kind": "load_state",
          "state": "domcontentloaded",
          "timeout_ms": 30000
        },
        {
          "kind": "locator",
          "locator": {
            "kind": "css",
            "value": "pngx-document-detail"
          },
          "state": "visible",
          "timeout_ms": 30000
        },
        {
          "kind": "dom_quiet",
          "quiet_ms": 400,
          "timeout_ms": 30000
        }
      ]
    },
    {
      "scenario_step_id": "story.s004",
      "workflow_step_id": "story.s004.navigate",
      "global_step_index": 4,
      "actor_id": "actor_a",
      "action": {
        "kind": "navigate",
        "url": "http://127.0.0.1:18091/documents/1/permissions"
      },
      "waits": [
        {
          "kind": "load_state",
          "state": "domcontentloaded",
          "timeout_ms": 30000
        },
        {
          "kind": "locator",
          "locator": {
            "kind": "css",
            "value": "pngx-document-detail"
          },
          "state": "visible",
          "timeout_ms": 30000
        },
        {
          "kind": "dom_quiet",
          "quiet_ms": 400,
          "timeout_ms": 30000
        }
      ]
    }
  ]
}
