{
  "schema_version": "uisemtest-recording-workflow-v1",
  "workflow_id": "conduit-modular-l1-profile-02",
  "profile_ref": "fixtures/profiles/conduit_guest_current_local.json",
  "actors": [
    {
      "actor_id": "guest",
      "bootstrap": [
        {
          "bootstrap_step_id": "bootstrap.guest.home",
          "action": {
            "kind": "navigate",
            "url": "/"
          },
          "waits": [
            {
              "kind": "load_state",
              "state": "domcontentloaded",
              "timeout_ms": 30000
            },
            {
              "kind": "dom_quiet",
              "quiet_ms": 200,
              "timeout_ms": 30000
            }
          ]
        }
      ],
      "ready_waits": [
        {
          "kind": "locator",
          "locator": {
            "kind": "css",
            "value": "a[href=\"#/login\"]"
          },
          "state": "visible",
          "timeout_ms": 30000
        }
      ]
    }
  ],
  "steps": [
    {
      "scenario_step_id": "story.s000",
      "workflow_step_id": "story.s000.open-missing-profile",
      "global_step_index": 0,
      "actor_id": "guest",
      "action": {
        "kind": "navigate",
        "url": "/#/profile/missing_profile_example"
      },
      "waits": [
        {
          "kind": "load_state",
          "state": "domcontentloaded",
          "timeout_ms": 30000
        },
        {
          "kind": "locator",
          "locator": {
            "kind": "css",
            "value": "h1",
            "has_text": "404 Not Found"
          },
          "state": "visible",
          "timeout_ms": 30000
        }
      ]
    }
  ]
}
