{
  "schema_version": "uisemtest-recording-workflow-v1",
  "workflow_id": "ghost-modular-l1-tag-01",
  "profile_ref": "fixtures/profiles/ghost_modular_local.json",
  "actors": [
    {
      "actor_id": "actor_a",
      "bootstrap": [
        {
          "bootstrap_step_id": "bootstrap.actor_a.entry",
          "action": {
            "kind": "navigate",
            "url": "http://127.0.0.1:18093/ghost/#/tags"
          },
          "waits": [
            {
              "kind": "load_state",
              "state": "domcontentloaded",
              "timeout_ms": 30000
            },
            {
              "kind": "dom_quiet",
              "quiet_ms": 300,
              "timeout_ms": 30000
            }
          ]
        }
      ],
      "ready_waits": [
        {
          "kind": "locator",
          "locator": {
            "kind": "css",
            "value": "[data-test-nav-menu=\"main\"]"
          },
          "state": "visible",
          "timeout_ms": 30000
        },
        {
          "kind": "locator",
          "locator": {
            "kind": "css",
            "value": "a[href=\"#/tags/new/\"]"
          },
          "state": "visible",
          "timeout_ms": 30000
        }
      ]
    }
  ],
  "steps": [
    {
      "scenario_step_id": "story.s000",
      "workflow_step_id": "story.s000.click-a-href-tags",
      "global_step_index": 0,
      "actor_id": "actor_a",
      "action": {
        "kind": "click",
        "locator": {
          "kind": "css",
          "value": "a[href=\"#/tags/new/\"]"
        }
      },
      "waits": [
        {
          "kind": "locator",
          "locator": {
            "kind": "css",
            "value": "#tag-name"
          },
          "state": "visible",
          "timeout_ms": 30000
        }
      ]
    },
    {
      "scenario_step_id": "story.s001",
      "workflow_step_id": "story.s001.fill-tag-name",
      "global_step_index": 1,
      "actor_id": "actor_a",
      "action": {
        "kind": "fill",
        "locator": {
          "kind": "css",
          "value": "#tag-name"
        },
        "value": "Release Notes"
      },
      "waits": [
        {
          "kind": "dom_quiet",
          "quiet_ms": 250,
          "timeout_ms": 30000
        }
      ]
    },
    {
      "scenario_step_id": "story.s002",
      "workflow_step_id": "story.s002.fill-tag-slug",
      "global_step_index": 2,
      "actor_id": "actor_a",
      "action": {
        "kind": "fill",
        "locator": {
          "kind": "css",
          "value": "#tag-slug"
        },
        "value": "release-notes"
      },
      "waits": [
        {
          "kind": "dom_quiet",
          "quiet_ms": 250,
          "timeout_ms": 30000
        }
      ]
    },
    {
      "scenario_step_id": "story.s003",
      "workflow_step_id": "story.s003.fill-tag-description",
      "global_step_index": 3,
      "actor_id": "actor_a",
      "action": {
        "kind": "fill",
        "locator": {
          "kind": "css",
          "value": "#tag-description"
        },
        "value": "Notes for each release."
      },
      "waits": [
        {
          "kind": "dom_quiet",
          "quiet_ms": 250,
          "timeout_ms": 30000
        }
      ]
    },
    {
      "scenario_step_id": "story.s004",
      "workflow_step_id": "story.s004.click-primary-save",
      "global_step_index": 4,
      "actor_id": "actor_a",
      "action": {
        "kind": "click",
        "locator": {
          "kind": "css",
          "value": "button.gh-btn-primary",
          "has_text": "Save"
        }
      },
      "waits": [
        {
          "kind": "url",
          "pattern": "#/tags/release-notes",
          "timeout_ms": 30000
        },
        {
          "kind": "network_quiet",
          "quiet_ms": 400,
          "timeout_ms": 30000
        }
      ]
    }
  ]
}
