{
  "schema_version": "uisemtest-recording-workflow-v1",
  "workflow_id": "rwa-modular-l1-search-01",
  "profile_ref": "fixtures/profiles/rwa_modular_local.json",
  "actors": [
    {
      "actor_id": "actor_a",
      "bootstrap": [
        {
          "bootstrap_step_id": "bootstrap.actor_a.entry",
          "action": {
            "kind": "navigate",
            "url": "http://localhost:14000/"
          },
          "waits": [
            {
              "kind": "load_state",
              "state": "domcontentloaded",
              "timeout_ms": 30000
            },
            {
              "kind": "dom_quiet",
              "quiet_ms": 200,
              "timeout_ms": 30000
            }
          ]
        }
      ],
      "ready_waits": [
        {
          "kind": "locator",
          "locator": {
            "kind": "css",
            "value": "[data-test=nav-top-new-transaction]"
          },
          "state": "visible",
          "timeout_ms": 30000
        }
      ]
    }
  ],
  "steps": [
    {
      "scenario_step_id": "story.s000",
      "workflow_step_id": "story.s000.open-new",
      "global_step_index": 0,
      "actor_id": "actor_a",
      "action": {
        "kind": "click",
        "locator": {
          "kind": "css",
          "value": "[data-test=nav-top-new-transaction]"
        }
      },
      "waits": [
        {
          "kind": "locator",
          "locator": {
            "kind": "css",
            "value": "[data-test=user-list-search-input]"
          },
          "state": "visible",
          "timeout_ms": 30000
        }
      ]
    },
    {
      "scenario_step_id": "story.s001",
      "workflow_step_id": "story.s001.search-first",
      "global_step_index": 1,
      "actor_id": "actor_a",
      "action": {
        "kind": "fill",
        "locator": {
          "kind": "css",
          "value": "[data-test=user-list-search-input]"
        },
        "value": "Darrel"
      },
      "waits": [
        {
          "kind": "locator",
          "locator": {
            "kind": "css",
            "value": "[data-test^=user-list-item-]",
            "has_text": "Darrel"
          },
          "state": "visible",
          "timeout_ms": 30000
        }
      ]
    },
    {
      "scenario_step_id": "story.s002",
      "workflow_step_id": "story.s002.clear-first",
      "global_step_index": 2,
      "actor_id": "actor_a",
      "action": {
        "kind": "fill",
        "locator": {
          "kind": "css",
          "value": "[data-test=user-list-search-input]"
        },
        "value": ""
      },
      "waits": [
        {
          "kind": "dom_quiet",
          "quiet_ms": 200,
          "timeout_ms": 30000
        }
      ]
    },
    {
      "scenario_step_id": "story.s003",
      "workflow_step_id": "story.s003.search-last",
      "global_step_index": 3,
      "actor_id": "actor_a",
      "action": {
        "kind": "fill",
        "locator": {
          "kind": "css",
          "value": "[data-test=user-list-search-input]"
        },
        "value": "Ortiz"
      },
      "waits": [
        {
          "kind": "locator",
          "locator": {
            "kind": "css",
            "value": "[data-test^=user-list-item-]",
            "has_text": "Ortiz"
          },
          "state": "visible",
          "timeout_ms": 30000
        }
      ]
    },
    {
      "scenario_step_id": "story.s004",
      "workflow_step_id": "story.s004.clear-last",
      "global_step_index": 4,
      "actor_id": "actor_a",
      "action": {
        "kind": "fill",
        "locator": {
          "kind": "css",
          "value": "[data-test=user-list-search-input]"
        },
        "value": ""
      },
      "waits": [
        {
          "kind": "dom_quiet",
          "quiet_ms": 200,
          "timeout_ms": 30000
        }
      ]
    },
    {
      "scenario_step_id": "story.s005",
      "workflow_step_id": "story.s005.search-username",
      "global_step_index": 5,
      "actor_id": "actor_a",
      "action": {
        "kind": "fill",
        "locator": {
          "kind": "css",
          "value": "[data-test=user-list-search-input]"
        },
        "value": "Dina20"
      },
      "waits": [
        {
          "kind": "locator",
          "locator": {
            "kind": "css",
            "value": "[data-test^=user-list-item-]",
            "has_text": "Dina20"
          },
          "state": "visible",
          "timeout_ms": 30000
        }
      ]
    },
    {
      "scenario_step_id": "story.s006",
      "workflow_step_id": "story.s006.clear-username",
      "global_step_index": 6,
      "actor_id": "actor_a",
      "action": {
        "kind": "fill",
        "locator": {
          "kind": "css",
          "value": "[data-test=user-list-search-input]"
        },
        "value": ""
      },
      "waits": [
        {
          "kind": "dom_quiet",
          "quiet_ms": 200,
          "timeout_ms": 30000
        }
      ]
    },
    {
      "scenario_step_id": "story.s007",
      "workflow_step_id": "story.s007.search-email",
      "global_step_index": 7,
      "actor_id": "actor_a",
      "action": {
        "kind": "fill",
        "locator": {
          "kind": "css",
          "value": "[data-test=user-list-search-input]"
        },
        "value": "Marielle_Wiza@yahoo.com"
      },
      "waits": [
        {
          "kind": "locator",
          "locator": {
            "kind": "css",
            "value": "[data-test^=user-list-item-]",
            "has_text": "Marielle_Wiza@yahoo.com"
          },
          "state": "visible",
          "timeout_ms": 30000
        }
      ]
    },
    {
      "scenario_step_id": "story.s008",
      "workflow_step_id": "story.s008.clear-email",
      "global_step_index": 8,
      "actor_id": "actor_a",
      "action": {
        "kind": "fill",
        "locator": {
          "kind": "css",
          "value": "[data-test=user-list-search-input]"
        },
        "value": ""
      },
      "waits": [
        {
          "kind": "dom_quiet",
          "quiet_ms": 200,
          "timeout_ms": 30000
        }
      ]
    },
    {
      "scenario_step_id": "story.s009",
      "workflow_step_id": "story.s009.search-phone",
      "global_step_index": 9,
      "actor_id": "actor_a",
      "action": {
        "kind": "fill",
        "locator": {
          "kind": "css",
          "value": "[data-test=user-list-search-input]"
        },
        "value": "887-309-1593"
      },
      "waits": [
        {
          "kind": "locator",
          "locator": {
            "kind": "css",
            "value": "[data-test^=user-list-item-]",
            "has_text": "887-309-1593"
          },
          "state": "visible",
          "timeout_ms": 30000
        }
      ]
    },
    {
      "scenario_step_id": "story.s010",
      "workflow_step_id": "story.s010.clear-phone",
      "global_step_index": 10,
      "actor_id": "actor_a",
      "action": {
        "kind": "fill",
        "locator": {
          "kind": "css",
          "value": "[data-test=user-list-search-input]"
        },
        "value": ""
      },
      "waits": [
        {
          "kind": "dom_quiet",
          "quiet_ms": 200,
          "timeout_ms": 30000
        }
      ]
    },
    {
      "scenario_step_id": "story.s011",
      "workflow_step_id": "story.s011.search-self",
      "global_step_index": 11,
      "actor_id": "actor_a",
      "action": {
        "kind": "fill",
        "locator": {
          "kind": "css",
          "value": "[data-test=user-list-search-input]"
        },
        "value": "Heath93"
      },
      "waits": [
        {
          "kind": "locator",
          "locator": {
            "kind": "css",
            "value": "[data-test^=user-list-item-]",
            "has_text": "Heath93"
          },
          "state": "hidden",
          "timeout_ms": 30000
        }
      ]
    }
  ]
}
