{
  "schema_version": "uisemtest-recording-workflow-v1",
  "workflow_id": "umami-l1-user-03",
  "profile_ref": "fixtures/profiles/umami_modular_local.json",
  "actors": [
    {
      "actor_id": "actor_a",
      "bootstrap": [
        {
          "bootstrap_step_id": "bootstrap.actor_a.entry",
          "action": {
            "kind": "navigate",
            "url": "http://127.0.0.1:18090/websites"
          },
          "waits": [
            {
              "kind": "load_state",
              "state": "domcontentloaded",
              "timeout_ms": 30000
            },
            {
              "kind": "dom_quiet",
              "quiet_ms": 250,
              "timeout_ms": 30000
            }
          ]
        }
      ],
      "ready_waits": [
        {
          "kind": "locator",
          "locator": {
            "kind": "css",
            "value": "a[href=\"/websites\"]"
          },
          "state": "visible",
          "timeout_ms": 30000
        }
      ]
    }
  ],
  "steps": [
    {
      "scenario_step_id": "story.s000",
      "workflow_step_id": "story.s000.navigate",
      "global_step_index": 0,
      "actor_id": "actor_a",
      "action": {
        "kind": "navigate",
        "url": "http://127.0.0.1:18090/admin/users"
      },
      "waits": [
        {
          "kind": "load_state",
          "state": "domcontentloaded",
          "timeout_ms": 30000
        },
        {
          "kind": "dom_quiet",
          "quiet_ms": 250,
          "timeout_ms": 30000
        }
      ]
    },
    {
      "scenario_step_id": "story.s001",
      "workflow_step_id": "story.s001.click",
      "global_step_index": 1,
      "actor_id": "actor_a",
      "action": {
        "kind": "click",
        "locator": {
          "kind": "css",
          "value": "[data-test=\"button-create-user\"]"
        }
      },
      "waits": [
        {
          "kind": "dom_quiet",
          "quiet_ms": 250,
          "timeout_ms": 30000
        }
      ]
    },
    {
      "scenario_step_id": "story.s002",
      "workflow_step_id": "story.s002.fill",
      "global_step_index": 2,
      "actor_id": "actor_a",
      "action": {
        "kind": "fill",
        "locator": {
          "kind": "css",
          "value": "[data-test=\"input-username\"]"
        },
        "value": "Test-user"
      },
      "waits": []
    },
    {
      "scenario_step_id": "story.s003",
      "workflow_step_id": "story.s003.fill",
      "global_step_index": 3,
      "actor_id": "actor_a",
      "action": {
        "kind": "fill",
        "locator": {
          "kind": "css",
          "value": "[data-test=\"input-password\"]"
        },
        "value": "testPasswordPlaywright"
      },
      "waits": []
    },
    {
      "scenario_step_id": "story.s004",
      "workflow_step_id": "story.s004.click",
      "global_step_index": 4,
      "actor_id": "actor_a",
      "action": {
        "kind": "click",
        "locator": {
          "kind": "css",
          "value": "button[data-slot=\"select-trigger\"]"
        }
      },
      "waits": [
        {
          "kind": "dom_quiet",
          "quiet_ms": 250,
          "timeout_ms": 30000
        }
      ]
    },
    {
      "scenario_step_id": "story.s005",
      "workflow_step_id": "story.s005.click",
      "global_step_index": 5,
      "actor_id": "actor_a",
      "action": {
        "kind": "click",
        "locator": {
          "kind": "css",
          "value": "[data-test=\"dropdown-item-user\"]"
        }
      },
      "waits": [
        {
          "kind": "dom_quiet",
          "quiet_ms": 250,
          "timeout_ms": 30000
        }
      ]
    },
    {
      "scenario_step_id": "story.s006",
      "workflow_step_id": "story.s006.click",
      "global_step_index": 6,
      "actor_id": "actor_a",
      "action": {
        "kind": "click",
        "locator": {
          "kind": "css",
          "value": "[data-test=\"button-submit\"]"
        }
      },
      "waits": [
        {
          "kind": "dom_quiet",
          "quiet_ms": 250,
          "timeout_ms": 30000
        }
      ]
    },
    {
      "scenario_step_id": "story.s007",
      "workflow_step_id": "story.s007.click",
      "global_step_index": 7,
      "actor_id": "actor_a",
      "action": {
        "kind": "click",
        "locator": {
          "kind": "css",
          "value": "tr:has-text(\"test-user\") button"
        }
      },
      "waits": [
        {
          "kind": "dom_quiet",
          "quiet_ms": 250,
          "timeout_ms": 30000
        }
      ]
    },
    {
      "scenario_step_id": "story.s008",
      "workflow_step_id": "story.s008.click",
      "global_step_index": 8,
      "actor_id": "actor_a",
      "action": {
        "kind": "click",
        "locator": {
          "kind": "css",
          "value": "[data-test=\"link-button-delete\"]"
        }
      },
      "waits": [
        {
          "kind": "dom_quiet",
          "quiet_ms": 250,
          "timeout_ms": 30000
        }
      ]
    },
    {
      "scenario_step_id": "story.s009",
      "workflow_step_id": "story.s009.click",
      "global_step_index": 9,
      "actor_id": "actor_a",
      "action": {
        "kind": "click",
        "locator": {
          "kind": "css",
          "value": "button[data-slot=\"alert-dialog-action\"]"
        }
      },
      "waits": [
        {
          "kind": "dom_quiet",
          "quiet_ms": 250,
          "timeout_ms": 30000
        }
      ]
    }
  ]
}
