{
  "schema_version": "uisemtest-recording-workflow-v1",
  "workflow_id": "rwa-modular-l2-settings-01",
  "profile_ref": "fixtures/profiles/rwa_modular_local.json",
  "actors": [
    {
      "actor_id": "actor_a",
      "bootstrap": [
        {
          "bootstrap_step_id": "bootstrap.actor_a.entry",
          "action": {
            "kind": "navigate",
            "url": "http://localhost:14000/"
          },
          "waits": [
            {
              "kind": "load_state",
              "state": "domcontentloaded",
              "timeout_ms": 30000
            },
            {
              "kind": "dom_quiet",
              "quiet_ms": 200,
              "timeout_ms": 30000
            }
          ]
        }
      ],
      "ready_waits": [
        {
          "kind": "locator",
          "locator": {
            "kind": "css",
            "value": "[data-test=nav-top-new-transaction]"
          },
          "state": "visible",
          "timeout_ms": 30000
        }
      ]
    }
  ],
  "steps": [
    {
      "scenario_step_id": "story.s000",
      "workflow_step_id": "story.s000.open-settings",
      "global_step_index": 0,
      "actor_id": "actor_a",
      "action": {
        "kind": "click",
        "locator": {
          "kind": "css",
          "value": "[data-test=sidenav-user-settings]"
        }
      },
      "waits": [
        {
          "kind": "url",
          "pattern": ".*/user/settings$",
          "timeout_ms": 30000
        },
        {
          "kind": "locator",
          "locator": {
            "kind": "css",
            "value": "[data-test=user-settings-form]"
          },
          "state": "visible",
          "timeout_ms": 30000
        }
      ]
    },
    {
      "scenario_step_id": "story.s001",
      "workflow_step_id": "story.s001.fill-first-name",
      "global_step_index": 1,
      "actor_id": "actor_a",
      "action": {
        "kind": "fill",
        "locator": {
          "kind": "css",
          "value": "[data-test=user-settings-firstName-input]"
        },
        "value": "BeaconFirst"
      },
      "waits": []
    },
    {
      "scenario_step_id": "story.s002",
      "workflow_step_id": "story.s002.fill-last-name",
      "global_step_index": 2,
      "actor_id": "actor_a",
      "action": {
        "kind": "fill",
        "locator": {
          "kind": "css",
          "value": "[data-test=user-settings-lastName-input]"
        },
        "value": "BeaconLast"
      },
      "waits": []
    },
    {
      "scenario_step_id": "story.s003",
      "workflow_step_id": "story.s003.fill-email",
      "global_step_index": 3,
      "actor_id": "actor_a",
      "action": {
        "kind": "fill",
        "locator": {
          "kind": "css",
          "value": "[data-test=user-settings-email-input]"
        },
        "value": "beacon.two@example.test"
      },
      "waits": []
    },
    {
      "scenario_step_id": "story.s004",
      "workflow_step_id": "story.s004.fill-phone",
      "global_step_index": 4,
      "actor_id": "actor_a",
      "action": {
        "kind": "fill",
        "locator": {
          "kind": "css",
          "value": "[data-test=user-settings-phoneNumber-input]"
        },
        "value": "6155551212"
      },
      "waits": []
    },
    {
      "scenario_step_id": "story.s005",
      "workflow_step_id": "story.s005.save-settings",
      "global_step_index": 5,
      "actor_id": "actor_a",
      "action": {
        "kind": "click",
        "locator": {
          "kind": "css",
          "value": "[data-test=user-settings-submit]"
        }
      },
      "waits": [
        {
          "kind": "locator",
          "locator": {
            "kind": "css",
            "value": "[data-test=sidenav-user-full-name]",
            "has_text": "BeaconFirst"
          },
          "state": "visible",
          "timeout_ms": 30000
        }
      ],
      "binding_material_source_step_ids": [
        "story.s001.fill-first-name",
        "story.s002.fill-last-name",
        "story.s003.fill-email",
        "story.s004.fill-phone"
      ]
    },
    {
      "scenario_step_id": "story.s006",
      "workflow_step_id": "story.s006.reload-home",
      "global_step_index": 6,
      "actor_id": "actor_a",
      "action": {
        "kind": "navigate",
        "url": "http://localhost:14000/"
      },
      "waits": [
        {
          "kind": "locator",
          "locator": {
            "kind": "css",
            "value": "[data-test=sidenav-user-full-name]",
            "has_text": "BeaconFirst"
          },
          "state": "visible",
          "timeout_ms": 30000
        }
      ]
    },
    {
      "scenario_step_id": "story.s007",
      "workflow_step_id": "story.s007.reopen-settings",
      "global_step_index": 7,
      "actor_id": "actor_a",
      "action": {
        "kind": "navigate",
        "url": "http://localhost:14000/user/settings"
      },
      "waits": [
        {
          "kind": "locator",
          "locator": {
            "kind": "css",
            "value": "[data-test=user-settings-form]"
          },
          "state": "visible",
          "timeout_ms": 30000
        }
      ]
    }
  ]
}
