{
  "schema_version": "uisemtest-recording-workflow-v1",
  "workflow_id": "conduit-modular-l1-settings-01",
  "profile_ref": "fixtures/profiles/conduit_current_local.json",
  "actors": [
    {
      "actor_id": "actor_a",
      "bootstrap": [
        {
          "bootstrap_step_id": "bootstrap.actor_a.home",
          "action": {
            "kind": "navigate",
            "url": "/"
          },
          "waits": [
            {
              "kind": "load_state",
              "state": "domcontentloaded",
              "timeout_ms": 30000
            },
            {
              "kind": "dom_quiet",
              "quiet_ms": 200,
              "timeout_ms": 30000
            }
          ]
        }
      ],
      "ready_waits": [
        {
          "kind": "locator",
          "locator": {
            "kind": "css",
            "value": "a[href=\"#/editor\"]"
          },
          "state": "visible",
          "timeout_ms": 30000
        }
      ]
    }
  ],
  "steps": [
    {
      "scenario_step_id": "story.s000",
      "workflow_step_id": "story.s000.open-settings",
      "global_step_index": 0,
      "actor_id": "actor_a",
      "action": {
        "kind": "navigate",
        "url": "/#/settings"
      },
      "waits": [
        {
          "kind": "url",
          "pattern": ".*/#/settings$",
          "timeout_ms": 30000
        }
      ]
    },
    {
      "scenario_step_id": "story.s001",
      "workflow_step_id": "story.s001.clear-username",
      "global_step_index": 1,
      "actor_id": "actor_a",
      "action": {
        "kind": "fill",
        "locator": {
          "kind": "css",
          "value": "input[placeholder=\"Your Name\"]"
        },
        "value": ""
      },
      "waits": []
    },
    {
      "scenario_step_id": "story.s002",
      "workflow_step_id": "story.s002.submit-missing-username",
      "global_step_index": 2,
      "actor_id": "actor_a",
      "action": {
        "kind": "click",
        "locator": {
          "kind": "role",
          "value": "button",
          "name": "Update Settings",
          "exact": true,
          "scope": {
            "kind": "css",
            "value": "form"
          }
        }
      },
      "waits": [
        {
          "kind": "locator",
          "locator": {
            "kind": "css",
            "value": "input[placeholder=\"Your Name\"]"
          },
          "state": "visible",
          "timeout_ms": 30000
        }
      ]
    },
    {
      "scenario_step_id": "story.s003",
      "workflow_step_id": "story.s003.restore-username",
      "global_step_index": 3,
      "actor_id": "actor_a",
      "action": {
        "kind": "fill",
        "locator": {
          "kind": "css",
          "value": "input[placeholder=\"Your Name\"]"
        },
        "value_env": "UISEMTEST_CONDUIT_ACTOR_A_USERNAME"
      },
      "waits": []
    },
    {
      "scenario_step_id": "story.s004",
      "workflow_step_id": "story.s004.clear-email",
      "global_step_index": 4,
      "actor_id": "actor_a",
      "action": {
        "kind": "fill",
        "locator": {
          "kind": "css",
          "value": "input[placeholder=\"Email\"]"
        },
        "value": ""
      },
      "waits": []
    },
    {
      "scenario_step_id": "story.s005",
      "workflow_step_id": "story.s005.submit-missing-email",
      "global_step_index": 5,
      "actor_id": "actor_a",
      "action": {
        "kind": "click",
        "locator": {
          "kind": "role",
          "value": "button",
          "name": "Update Settings",
          "exact": true,
          "scope": {
            "kind": "css",
            "value": "form"
          }
        }
      },
      "waits": [
        {
          "kind": "locator",
          "locator": {
            "kind": "css",
            "value": "input[placeholder=\"Email\"]"
          },
          "state": "visible",
          "timeout_ms": 30000
        }
      ]
    }
  ]
}
